Producto,Precio
Yogurt de Pajarito Ghali Sabor Natural 400 g,$3.400
Leche Ecoterra Entera Vacas Libre Pastoreo 1 L,$2.849
Postre Soprole Arroz con Leche Caramelo 130 g,$679
Pack Leche Loncoleche Semidescremada Plátano 200 ml 6 un.,$3.174
Pack Leche Cuisine & Co Sin Lactosa Descremada 1 L 12 un.,$15.468
Pack Leche Cuisine & Co Entera 1 L 12 un.,$12.708
Mantequilla Ecoterra Con Sal Vacas Libre Pastoreo 250 g,$4.179
Huevos Yemita Grandes Color 12 un.,$3.889
Pack Yogurt Batido Nestlé Berries 115 g 12 un.,$3.499
Huevos Yemita Medianos Extra Blancos 30 un.,$8.499
Leche Surlat Proteína Sin Lactosa Chocolate 200 ml,$609
Mantequilla Vegana Earth Balance Barras Sin Soya 454 g,$7.999
Yogurt Loncoleche Protein Mango Maracuyá Trozos 140 g,$719
Yogurt Griego Colun Light Papaya 120 g,$609
Compota Nestlé Durazno 120 g,$475
Compota Nestlé Manzana 120 g,$475
Margarina Qualy Con Sal 1 kg,$4.390
Leche Colun Sin Lactosa Cappuccino 1 L,$2.419
Pack Leche Colun Entera Sin Lactosa 1 L 12 un.,$16.428
Pack Probiótico Uno Frutilla 80 ml 6 un.,$2.089
Yogurt Griego Quillayes Triple 0% Frutilla Pote 800 g,$3.679
Pack Leche Colun Light Cappuccino Prisma 330 ml 3 un.,$3.177
Yogurt Griego Quillayes Triple 0% Berries 110 g,$499
Yogurt Griego Quillayes Triple 0% Duraznos 110 g,$499
Pack Leche Colun Semidescremada Chocolate Receta Original 1 L 12 un.,$17.400
Pack Leche Loncoleche Chocolate Semidescremada Sin Lactosa 200 ml 6 un.,$3.174
Pack Bebida Láctea Yogu Yogu Piña 200 ml 6 un.,$3.630
Pack Bebida Láctea Loncoleche Manjar 170 ml 6 un.,$3.534
Pack Leche Surlat Descremada Sin Lactosa 200 ml 6 un.,$2.634
Pack Leche Loncoleche Natural Sin Lactosa 1 L 12 un.,$16.188
Yogurt Batido Nestlé Damasco 115 g,$285
Yogurt Batido Nestlé Vainilla 115 g,$285
Yogurt Batido Nestlé Frutilla 115 g,$285
Pack Bebida Láctea Loncoleche Protein Shot Vainilla 100 ml 6 un.,$3.849
Pack Bebida Láctea Chamyto Frambuesa 80 ml 6 un.,$2.599
Pack Bebida Láctea Calán Probióticos Multifruta 90 ml 6 un.,$2.339
Yogurt + Cereal Nestlé Trix 142 g,$689
Yogurt Pucará Con Mermelada de Frambuesa 230 g,$1.699
Yogurt Natural Pucará 210 g,$1.699
Levadura Collico Fresca 38 g,$519
Yogurt Batido Loncoleche Sin Lactosa Chirimoya Bolsa 900 g,$2.139
Postre Soprole Gold Pistacho 120 g,$719
Jalea Nestlé Guinda 110 g,$375
Mantequilla Elle & Vire Con Sal 200 g,$4.349
Leche Polvo Colun Entera 1440 g,$12.650
Leche Polvo Calo Descremada 800 g,$6.929
Pack Leche Soprole Entera Natural 1 L 12 un.,$14.388
Yogurt Griego Quillayes Light Frutilla 110 g,$519
Yogurt Griego Oikos Colchón de Durazno 150 g,$709
Yogurt Batido Loncoleche Sin Lactosa Frutilla 900 ml,$2.400
Yogurt Batido Loncoleche Sin Lactosa Chirimoya 900 g,$2.400
Yogurt Batido Light & Free Frutilla 900 g,$2.899
Yogurt Light & Free Natural 900 g,$2.899
Yogurt Batido Calán Frutilla 1 kg,$1.619
Yogurt Batido Calán Chirimoya 1 kg,$1.619
Yogurt Batido Calán Semidescremado Chirimoya 120 g,$265
Petit Suisse Chiquitín Plátano 45 g,$335
Petit Suisse Chiquitín Damasco 45 g,$335
Margarina Soprole Pote 500 g,$2.589
Margarina Loncoleche Sin Lactosa 500 g,$3.249
Bebida Láctea Yogu Yogu Mora 200 ml,$605
Bebida Láctea Yogu Yogu Damasco 200 ml,$605
Leche Soprole Semidescremada Frutilla 200 ml,$525
Leche Soprole Semidescremada Chocolate Requetepatitas 200 ml,$525
Leche Loncoleche Vainilla 1 L,$1.489
Leche Loncoleche Semidescremada Chocolate 1 L,$1.489
Leche Loncoleche Semidescremada Sin Lactosa Chocolate 1 L,$2.100
Leche Loncoleche Sin Lactosa Vainilla 1 L,$2.100
Leche Loncoleche Semidescremada Plátano 1 L,$1.489
Leche Loncoleche Sin Lactosa Frutilla 1 L,$2.100
Leche Loncoleche Light Descremada Chocolate 200 ml,$529
Leche Colun Manjar 200 cc,$579
Leche Colun Light Chocolate 200 ml,$629
Leche Cultivada Loncoleche Light Vainilla 1 L,$2.059
Leche Cultivada Loncoleche Light Frutilla 1 L,$2.059
Leche Polvo Svelty Huesos Calcilock 800 g,$8.460
Leche Loncoleche Semidescremada Sin Lactosa 200 ml,$529
Leche Polvo Loncoleche Sin Lactosa 800 g,$11.440
Probiótico Uno Manzana 80 ml,$4.299
Saborizante Para Leche Cola Cao Noir 280 g,$4.224
Leche Polvo Nido +1 Nutri Esencial 500 g,$3.990
Leche Ecoterra Entera 1 L,$3.299
Leche Polvo Colun Semidescremada 900 g,$8.799
Mantequilla San Ignacio Sal de Mar 230 g,$3.449
Huevos Santa Marta Extra Blanco 15 un.,$4.790
Leche Polvo Nido Entera 1.9 kg,$19.350
Pack Yogurt Con Cereal Nestlé Chocapic y Trix 5 un.,$3.439
Yogurt Colun Light Damasco 900 g,$1.799
Yogurt Loncoleche Sin Lactosa Frutilla 140 g,$390
Yogurt Soprole Batifrut Cremoso Frutilla 120 g,$529
Yogurt Soprole Batifrut Cremoso Piña 120 g,$529
Margarina Cuisine & Co Cremosa 500 g,$2.339
Leche Polvo Nido Semidescremada Sin Lactosa 1.35 kg,$15.992
Pack Yogurt Surlat Benecol Sin Lactosa Frutilla 125 g 4 un.,$2.690
Leche Soprole Chocolate Gold 1 L,$2.229
Pack Yogurt Surlat Benecol Sin Lactosa Frutilla 80 ml 4 un.,$2.690
Compota Soprole Manzana Plátano 110 g,$499
Compota Soprole Manzana Pera 110 g,$499
Compota Soprole Manzana Frutos Rojos 110 g,$499
Leche Polvo Nido Entera 1.35 kg,$14.690
Pack Bebida Láctea Calán Frutilla 98 ml 12 un.,$3.589
Pack Yogurt Kéfir Quillayes Natural 80 ml 4 un.,$2.350
Yogurt Quillayes Kéfir Naranja Pomelo 900 ml,$2.820
Yogurt Colun del Sur Frutos del Sur 120 g,$529
Mantequilla Ecoterra Sin Sal Vacas Libre Pastoreo 250 g,$3.969
Leche con Chocolate Milo Protein Up 330 ml,$1.479
Yogurt Artesanal Jumbo Mermelada de Damasco 200 g,$1.249
Yogurt Artesanal Jumbo Mermelada de Frutilla 200 g,$1.249
Yogurt Soprole Gold Nuez Cranberry 165 g,$699
Mantequilla Kerrygold Irlandesa Sin Sal 200 g,$4.290
Leche de Cabra Ecoterra Libre Pastoreo 1 L,$4.299
Mantequilla Nutrileza Ghee Clarificada 200 g,$7.890
Huevos Duros de Codorniz Doña Blanca 18 un.,$4.999
Leche Colun Light Sin Lactosa Chocolate 330 ml,$1.039
Compota Nestlé Pera 120 g,$475
Leche Cuisine & Co Chocolate 1 L,$1.489
Pack Bebida Láctea Calán Probióticos Mora 90 ml 6 un.,$2.339
Yogurt Skyr San Benito Frutilla 150 g,$969
Yogurt Skyr San Benito Maracuyá 150 g,$969
Margarina Cuisine & Co Canola Pote 400 g,$2.000
Leche de Cabra Las Hualtatas Entera 1 L,$3.599
Mantequilla Nutrileza Ghee Clarificada Sin Sal 350 g,$11.990
Yogurt Descremado Artisan Sin Lactosa 360 g,$1.999
Yogurt Trozos Quillayes Berries Pote 800 g,$3.459
Yogurt Griego Quillayes Triple 0% Trozos de Papaya 800 g,$3.679
Yogurt Soprole Sin Lactosa Frutilla 155 g,$619
Pack Leche Colun Caramelo Prisma 330 ml 3 un.,$3.177
Pack Leche Colun Cappuccino Sin Lactosa 330 ml 3 un.,$3.177
Yogurt Descremado Artisan Frutilla 150 g,$1.049
Pack Leche Loncoleche Chocolate 200 ml 6 un.,$3.174
Pack Bebida Láctea Loncoleche Chocolate 170 ml 6 un.,$3.534
Pack Leche Loncoleche Vainilla 200 ml 6 un.,$3.174
Leche de Cabra Polvo Dagoat Entera 400 g,$9.190
Pack Leche Loncoleche Semidescremada Sin Lactosa 1 L 12 un.,$16.188
Leche Loncoleche Break Sin Lactosa Chocolate y Avellana 1 L,$2.599
Leche Colun Capuccino Sin Lactosa 330 cc,$1.059
Leche Colun Café Caramelo Light Sin Lactosa 330 cc,$1.059
Leche Colun Café Caramelo Sin Lactosa 330 cc,$1.059
Leche Surlat Descremada Sin Lactosa 200 ml,$505
Huevos Ecoterra Gallinas Libres Medianos 12 un.,$5.429
Pack Leche Soprole Sin Lactosa Chocolate 1 L 12 un.,$23.148
Pack Leche Soprole Semidescremada Chocolate 1 L 12 un.,$17.988
Pack Bebida Láctea Chamyto Manzana 80 ml 6 un.,$2.599
Pack Bebida Láctea Calán Probióticos Frutilla 90 ml 6 un.,$2.339
Yogurt Pucará Con Mermelada de Mora 230 g,$1.699
Yogurt Pucará Con Mermelada de Frutilla 230 g,$1.699
Yogurt Pucará Con Mermelada de Damasco 230 g,$1.699
Leche Polvo Calo Entera 850 g,$7.229
Yogurt Colun Yogumix Chocolate 140 g,$689
Yogurt + Cereal Nestlé Milo 142 g,$689
Yogurt + Cereal Nestlé Chocapic 142 g,$689
Pack Probiótico Uno Frutilla 80 ml 6 un.,$2.229
Margarina Sureña 500 g,$2.719
Margarina Sureña con Mantequilla 1 kg,$4.650
Margarina Pamperita 1 kg,$3.129
Leche Danone Moments Moca 200 ml,$719
Leche Danone Moments Moca 1 L,$2.589
Levadura Lefersa Fresca 500 g,$2.489
Flan Colun Manjar 100 g,$379
Yogurt Surlat Sin Lactosa Colágeno Hidrolizado Natural 125 g,$469
Yogurt Surlat Sin Lactosa Colágeno Hidrolizado Frutilla 125 g,$469
Yogurt Surlat Sin Lactosa Colágeno Hidrolizado Maqui 125 g,$469
Pack Jalea Nestlé Pap 110 g 4 un.,$1.769
Leche Soprole Next Colágeno Natural 1 L,$1.574
Huevos Santa Marta Extra Color 15 un.,$4.949
Leche Polvo Svelty Semidescremada 700 g,$7.590
Pack Bebida Láctea Surlat Sin Lactosa Probióticos Manzana 12 un.,$3.999
Saborizante Swiss Miss Chocolate Avellana 108 g,$3.003
Pack Leche Surlat Entera 1 L 6 un.,$7.974
Leche Loncoleche Break Dark Chocolate 250 ml,$799
Leche Polvo Nido 1+ Excella Gold 1.35 kg,$19.720
Leche Polvo Nido Semidescremada 1.35 kg,$11.752
Pack Yogurt Surlat Benecol Sin Lactosa Natural 125 g 4 un.,$2.690
Leche Soprole Capuccino Gold 1 L,$2.229
Pack Yogurt Surlat Benecol Sin Lactosa Natural 80 ml 4 un.,$2.690
Pack Yogurt Kéfir Quillayes Naranja Pomelo 80 ml 4 un.,$2.350
Yogurt de Pajarito Ghali Vainilla 400 g,$3.400
Alimento Nutricional Ensure Advance Chocolate 850 g,$30.770
Fórmula Láctea Nido Etapa 1+ Sin Lactosa 1560 g,$28.850
Yogurt Artesanal Jumbo Mermelada de Mora 200 g,$1.249
Yogurt Griego Quillayes Proteína Trozos Frutilla 110 g,$599
Pack Leche Cuisine & Co Chocolate 200 ml 6 un.,$2.994
Pack Leche Cuisine & Co Sin Lactosa Semidescremada 1 L 12 un.,$15.468
Leche Polvo Loncoleche Extra Proteína 550 g,$9.750
Yogurt Batido Tinguiririca Frutilla 1 L,$1.949
Café con Leche Nescafé Mokaccino 330 ml,$1.129
Café con Leche Nescafé Cappuccino 330 ml,$1.129
Leche Colun Sin Lactosa Chocolate 200 ml,$629
Leche Cuisine & Co Chocolate 200 ml,$499
Yogurt Clásico Artisan Natural 360 g,$1.999
Yogurt Descremado Artisan Natural Durazno 150 g,$999
Pack Leche Loncoleche Extra Proteína 1 L 12 un.,$29.148
Pack Leche Colun Vainilla 1 L 12 un.,$17.400
Yogurt Batido Tinguiririca Chirimoya 1 L,$1.949
Manteca Crucina Panadera Vegetal 1 kg,$3.649
Yogurt Griego Artisan Sin Lactosa Durazno 150 g,$1.049
Yogurt Griego Artisan Sin Lactosa Frutilla 150 g,$1.049
Pack Leche Soprole Semidescremada Frutilla 1 L 12 un.,$17.988
Pack Leche Colun Sin Lactosa Chocolate 1 L 12 un.,$23.988
Pack Leche Colun Chocolate Sin Tapa 1 L 12 un.,$17.400
Leche Polvo Loncoleche Extra Calcio 800 g,$8.790
Alimento Nutricional Ensure Advance 220 ml,$3.229
Yogurt + Cereal Nestlé Chocapic+ Milo Multipack 142 g 5 un.,$3.439
Margarina Qualy Blue 500 g,$2.639
Mantequilla Calo Con Sal 125 g,$1.719
Bebida Láctea Yogu Yogu Piña 200 ml,$605
Leche Loncoleche Vainilla 200 ml,$529
Leche Loncoleche Semidescremada Sin Lactosa Chocolate 200 ml,$529
Leche Loncoleche Semidescremada Plátano 200 ml,$529
Bebida Láctea Loncoleche Shake Shake Manjar 170 cc,$589
Leche Polvo Calo Crecer 1+ 1.5 kg,$11.211
Bebida Láctea Nido Buen Día Semidescremada 300 g,$3.359
Yogurt Batido Yogu Yogu Mora 115 ml,$369
Bebida Láctea Calán Probióticos Frutilla 90 g,$309
Huevos de Codorniz Doña Blanca 24 un.,$3.169
Leche Ecoterra Descremada Vacas Libre Pastoreo 1 L,$2.849
Manteca Crucina 1 kg,$5.429
Leche San Ignacio Entera Fresca 1 L,$3.049
Yogurt Trozos Quillayes Frutillas Pote 800 g,$3.459
Pack Leche Colun Frutilla 1 L 12 un.,$17.400
Pack Leche Loncoleche Sin Lactosa Chocolate 1 L 12 un.,$25.200
Pack Leche Loncoleche Light Chocolate 1 L 12 un.,$18.588
Yogurt Batido Tinguiririca Natural 1 L,$1.949
Yogurt Batido Tinguiririca Vainilla 1 L,$1.949
Leche San Ignacio Semidescremada 1 L,$3.049
Pack Leche Soprole Semidescremada Chocolate Requetepatitas 1 L 12 un.,$17.988
Levadura Collico Fresca 500 g,$2.329
Mantequilla Puerto Octay Con Sal 250 g,$3.329
Alimento Nutricional Ensure Advance Chocolate 220 ml,$3.229
Yogurt + Cereal Nestlé Chocapic + Zucosos Multipack 710 g,$3.439
Yogurt + Granola Mango Frambuesa un.,$1.990
Margarina Doña Juanita 1 kg,$3.749
Bebida Láctea Loncoleche Shake Shake Chocolate 170 cc,$589
Leche Loncoleche Semidescremada Chocolate 200 ml,$529
Leche de Cabra Polvo Dagoat Chocolate 400 g,$10.990
Leche Polvo Calo Entera 1.44 kg,$12.590
Pack Leche Soprole Semidescremada Cookies And Cream 1 L 12 un.,$17.988
Saborizante Swiss Miss Chocolate Blanco 313 g,$4.543
Huevos Ecoterra Gallinas Libres Regenerativos 10 un.,$5.549
Yogurt Batido Yogu Yogu Frutilla 115 ml,$369
Leche Ecoterra Semidescremada Chocolate Vacas Libre Pastoreo 1 L,$2.999
Mantequilla San Ignacio Vegetal Aceite Coco 125 g,$3.899
Manteca Soprole Bolsa 1 kg,$4.999
Pack Leche Colun Manjar 1 L 12 un.,$17.400
Leche Descremada Sin Lactosa Ecoterra 1 L,$3.299
Complemento Nutricional Ascenda Vainilla 800 g,$22.990
Huevos Ecoterra Gallinas Libres Circulares 10 un.,$5.549
Alimento Nutricional Ensure Advance Frutilla 850 g,$30.770
Alimento Nutricional Ensure Advance Frutilla Plátano 850 g,$30.770
Pack Suplemento Glucerna 237 ml 4 un.,$13.150
Leche de Burra Polvo Asinolat Liofilizada 180 g,$34.990
Pack Leche Cuisine & Co Chocolate 1 L 6 un.,$8.934
Pack Leche Loncoleche Sin Lactosa Frutilla 1 L 12 un.,$25.200
Pack Leche Loncoleche Chocolate 1 L 12 un.,$17.868
Pack Leche Loncoleche Plátano 1 L 12 un.,$17.868
Pack Leche Loncoleche Vainilla 1 L 12 un.,$17.868
Leche San Ignacio Descremada 1 L,$3.049
