Producto,Precio
Mantequilla Colun Con Sal 250 g,$3.099
Huevos Cuisine & Co Extra Grandes Blanco 20 un.,$6.299
Leche Cuisine & Co Descremada 1 L,$1.059
Yogurt Soprole Proteína Vainilla 155 g,$649
Yogurt Soprole Proteína Frutilla 155 g,$649
Yogurt Soprole Proteína Natural 155 g,$649
Yogurt Griego Oikos Natural Sin Endulzar 150 g,$555
Mantequilla Soprole Con Sal 250 g,$2.490
Leche Surlat Descremada Sin Lactosa 1 L,$1.329
Leche Soprole Sin Lactosa Descremada 1 L,$1.319
Huevos Cuisine & Co Extra Grandes Color 20 un.,$6.649
Huevos Cuisine & Co Gallinas Libres Extra Color 20 un.,$7.799
Yogurt Con Cereal Soprole 1+1 Mini Cookies 140 g,$659
Leche Cuisine & Co Semidescremada 1 L,$1.059
Leche Cuisine & Co Entera 1 L,$1.059
Yogurt Soprole Proteina Chirimoya 155 g,$649
Yogurt Loncoleche Protein Natural Endulzado 140 g,$669
Mantequilla Soprole Untable Pote 350 g,$5.549
Huevos La Granja Grandes Color 12 un.,$4.699
Pack Leche Colun Semidescremada Chocolate 200 ml 6 un.,$3.474
Yogurt Natural Soprole Aflanado 155 g,$479
Leche Colun Entera 1 L,$1.249
Leche Colun Descremada 1 L,$1.249
Leche Colun Semidescremada 1 L,$1.249
Huevos Omega3 Grandes Color 12 un.,$3.949
Huevos Cintazul Grandes Blancos 12 un.,$3.939
Huevos Cuisine & Co Medianos Blancos 30 un.,$8.099
Yogurt Griego Quillayes Proteína Natural 800 g,$3.649
Pack Yogurt Batido Soprole Frutilla 115 g 6 un.,$2.599
Leche Cuisine & Co Sin Lactosa Descremada 1 L,$1.289
Leche Soprole Proteína Natural 1 L,$2.289
Huevos Cintazul Gallinas Libres Grandes 12 un.,$4.490
Yogurt Colun Natural No Endulzado 120 g,$429
Leche Colun Entera Sin Lactosa 1 L,$1.369
Leche Loncoleche Descremada 1 L,$999
Leche Loncoleche Semidescremada 1 L,$999
Leche Loncoleche Entera 1 L,$999
Pack Yogurt Con Cereal Soprole 1+1 Zucaritas + Choco Krispis 140 g 5 un.,$3.199
Yogurt Soprole Sin Azúcar Trozos Frutos Secos 155 g,$625
Yogurt Soprole Proteína Trozos Arándano Frambuesa 155 g,$729
Yogurt Soprole Proteina Maracuya 155 g,$649
Yogurt Soprole Sin Azúcar Trozos Frutilla 155 g,$625
Yogurt Soprole Gold Tradicional 165 g,$699
Yogurt Con Cereal Soprole 1+1 Zucaritas 140 g,$659
Yogurt Soprole Sin Lactosa Vainilla 120 g,$339
Yogurt Soprole Sin Azúcar Vainilla 120 g,$325
Yogurt Soprole Sin Azúcar Frutilla 120 g,$325
Yogurt Batido Soprole Vainilla 120 g,$265
Yogurt Batido Soprole Frutilla 120 g,$265
Pack Probiótico Uno Multifruta 80 ml 12 un.,$4.299
Pack Bebida Láctea Chamyto Frutilla 80 ml 12 un.,$3.990
Yogurt Batido Colun Vainilla 125 g,$295
Yogurt Batido Colun Frutilla 125 g,$295
Postre Soprole Manjarate Original 80 g,$709
Mantequilla Soprole Sin Sal 250 g,$2.590
Mantequilla Soprole Con Sal de Mar 250 g,$3.049
Mantequilla Quillayes Con Sal 250 g,$2.949
Mantequilla Colun 200 g,$3.419
Leche Soprole Semidescremada Chocolate 1 L,$1.499
Leche Colun Semidescremada Chocolate 1 L,$1.719
Leche Surlat Semidescremada Sin Lactosa 1 L,$1.329
Leche Soprole Semidescremada Natural 1 L,$1.199
Leche Soprole Entera Natural 1 L,$1.199
Leche Soprole Sin Lactosa Semidescremada 1 L,$1.319
Leche Loncoleche Semidescremada Sin Lactosa 1 L,$1.349
Huevos Santa Marta Grandes Blancos 30 un.,$8.949
Huevos Santa Marta Grandes Blancos 12 un.,$3.629
Huevos Cintazul Extra Blancos 12 un.,$4.049
Mantequilla Soprole Untable Pote 200 g,$3.529
Leche Soprole Descremada Natural 1 L,$1.199
Yogurt Colun Sin Lactosa Vainilla 120 g,$359
Yogurt Colun Light Vainilla 120 g,$329
Yogurt Colun Light Frutilla 120 g,$329
Yogurt Colun Light Frambuesa 120 g,$329
Yogurt Colun Origen Vainilla 120 g,$379
Yogurt Colun Origen Natural 120 g,$379
Bebida Láctea Soprole Kéfir Berries 1 L,$2.199
Yogurt Soprole Proteína Frutos Secos 155 g,$729
Yogurt Soprole Proteína Frutos Secos 150 g,$799
Pack Yogurt Batido Soprole Vainilla 115 g 6 un.,$2.599
Leche Cuisine & Co Sin Lactosa Semidescremada 1 L,$1.289
Pack Leche Colun Sin Lactosa Descremada 200 ml 6 un.,$3.234
Yogurt Soprole Proteína Trozos Mango Maracuya 155 g,$729
Huevos Yemita Extra Blancos 20 un.,$6.699
Yogurt Colun Protein Plus Frutilla-Plátano 150 g,$729
Yogurt Colun Protein Plus Frutilla 150 g,$729
Yogurt Soprole 1+1 Pote 155 g,$479
Huevos Ecoterra Gallinas Libres 20 un.,$9.799
Pack Leche Colun Descremada Sin Lactosa 1 L 12 un.,$16.428
Leche Colun Semidescremada Sin Lactosa 1 L,$1.369
Pack Probiótico Uno Frutilla 80 ml 12 un.,$4.149
Yogurt Loncoleche Protein Arándano 140 g,$649
Huevos La Castellana Color Gallina Libre 12 un.,$4.699
Pack Leche Soprole Proteína Chocolate 200 ml 6 un.,$3.630
Yogurt Loncoleche Protein Frutilla 140 g,$669
Huevos Cuisine & Co Gallinas Libres Color 12 un.,$4.499
Yogurt Griego Oikos Frutilla 110 g,$359
Yogurt Griego Oikos Natural Endulzado 110 g,$359
Leche Loncoleche Extra Proteína 1 L,$1.900
Pack Leche Soprole Semidescremada Chocolate 200 ml 6 un.,$2.600
Huevos La Granja Grandes Color 6 un.,$2.799
Pack Bebida Láctea Chamyto Frambuesa 80 ml 12 un.,$3.990
Leche Cultivada Colun Light 0% + Fibra Chirimoya 1 L,$2.079
Yogurt Soprole Sin Azúcar Trozos Chía Arándano 155 g,$625
Yogurt Soprole Sin Azúcar Trozos Papaya 155 g,$625
Mantequilla Surlat Sin Lactosa 250 g,$3.289
Pack Yogurt Batido Colun 125 g 12 un.,$3.469
Pack Leche Surlat Semidescremada Sin Lactosa 1 L 6 un.,$7.974
Pack Leche Surlat Descremada Sin Lactosa 1 L 6 un.,$7.974
Pack Leche Soprole Sin Lactosa Chocolate 200 ml 6 un.,$3.030
Pack Leche Colun Semidescremada Vainilla 200 cc 6 un.,$3.474
Pack Leche Colun Original Chocolate 200 ml 6 un.,$3.474
Pack Leche Colun Semidescremada Frutilla 200 cc 6 un.,$3.474
Pack Jalea Regimel Frambuesa 100 g 4 un.,$2.069
Pack Jalea Regimel Arándano 100 g 4 un.,$2.069
Leche Colun Semidescremada Chocolate Receta Original 1 L,$1.719
Pack Probiótico Uno Frutilla 80 ml 18 un.,$6.249
Mantequilla Calo Con Sal Untable 350 g,$4.729
Yogurt Soprole Sin Lactosa Frutilla 120 g,$339
Yogurt Batido Soprole Plátano 120 g,$265
Yogurt Batido Soprole Damasco 120 g,$265
Yogurt Soprole Sin Lactosa Chirimoya 120 g,$339
Pack Probiótico Uno Frutilla 80 ml 12 un.,$4.299
Yogurt Griego Quillayes Sin Lactosa Berries 110 g,$499
Yogurt Griego Quillayes Sin Lactosa Papaya 110 g,$499
Pack Bebida Láctea Chamyto Manzana 80 ml 12 un.,$3.990
Yogurt Batido Colun Vainilla 1 kg,$1.889
Yogurt Batido Colun Plátano 125 g,$295
Yogurt Batido Colun Piña 125 g,$295
Yogurt Batido Colun Mora 125 g,$295
Yogurt Batido Colun Damasco 125 g,$295
Postre Soprole Sémola Caramelo 140 g,$669
Postre Soprole Leche Asada 120 g,$639
Jalea Soprole Piña 110 g,$309
Flan Soprole Caramelo 120 g,$359
Postre Soprole Arroz con Leche 130 g,$679
Postre Chandelle Crema Manjar 130 g,$799
Postre Chandelle Crema Sabor Chocolate 130 g,$799
Jalea Colun Frambuesa 100 g,$299
Margarina Soprole Mix Con Mantequilla Pote 500 g,$3.729
Mantequilla Soprole Con Sal 125 g,$1.549
Mantequilla Colun Sin Sal 250 g,$3.319
Mantequilla Colun Con Sal 125 g,$1.699
Leche Soprole Sin Lactosa Chocolate 1 L,$1.929
Leche Colun Semidescremada Chocolate 200 ml,$579
Leche Cultivada Colun Light 0% + Fibra Frutilla 1 L,$2.079
Leche Loncoleche Entera Sin Lactosa 1 L,$1.349
Huevos Santa Marta Grandes Color 12 un.,$3.799
Huevos Santa Marta Extra Blancos 12 un.,$3.989
Huevos Cintazul Grandes Color 30 un.,$9.999
Huevos Cintazul Grandes Blancos 30 un.,$8.790
Levadura Lefersa Fresca 38 g,$519
Leche Semidescremada Soprole con Avena 1 L,$1.200
Yogurt Nestlé Goodnes Protein Natural Endulzado 140 g,$589
Yogurt Vegetal Soya Loncoleche Trozos Mango Maracuyá 130 g,$629
Yogurt Vegetal Soya Loncoleche Trozos Frutilla 130 g,$629
Yogurt Activia Trozos Mango Maracuyá Sin Lactosa 140 g,$569
Yogurt Nestlé Goodnes Protein Frutilla 140 g,$589
Yogurt Danone Oikos Choco Crunch 142 g,$999
Huevos Cuisine & Co Gallinas Libres Grandes Color 30 un.,$10.649
Yogurt Soprole 1+1 Sin Lactosa Zucaritas 140 g,$669
Leche Surlat Descremada 1 L,$1.139
Leche Surlat Semidescremada 1 L,$1.139
Yogurt Soprole Proteína Nitro Trozos Mango 155 g,$729
Yogurt Kéfir Soprole Batido Berries 155 g,$439
Pack Yogurt Batido Colun Light 120 g 12 un.,$3.699
Yogurt Colun Light Mora 120 g,$329
Yogurt Colun Light Damasco 120 g,$329
Yogurt Colun Sin Lactosa Frutilla 120 g,$359
Yogurt Colun Light Natural 120 g,$329
Yogurt Colun Sin Lactosa Chirimoya 120 g,$359
Postre Colun del Sur Manjar 110 g,$619
Postre Colun del Sur Chocolate 110 g,$619
Yogurt Kéfir Colun Piña 120 g,$429
Yogurt Kéfir Colun Frutilla 120 g,$429
Yogurt Colun Sin Azúcar Frutilla 120 g,$329
Yogurt Colun Sin Azúcar Vainilla 120 g,$329
Saborizante para Leche Milo Polvo Chocolate 450 g,$5.299
Mantequilla Surlat Con Sal 200 g,$2.149
Yogurt Colun Sin Azúcar Chirimoya 120 g,$329
Pack Jalea Nestlé Goodnes Frambuesa 110 g 4 un.,$1.759
Leche Soprole Sin Lactosa Entera 1 L,$1.319
Yogurt Soprole 1+1 Botella 1 L,$2.589
Bebida Láctea Soprole Kéfir Natural 1 L,$2.199
Yogurt Soprole Proteína Kiwi Plátano Manzana 155 g,$729
Pack Yogurt Batido Yogu Yogu Mora 115 ml 6 un.,$2.214
Pack Yogurt Batido Yogu Yogu Frutilla 115 ml 6 un.,$2.214
Yogurt Soprole Proteína Frutos Secos 150 g,$799
Cacao Amargo En Polvo Edra 150 g,$1.459
Yogurt Con Cereal Soprole 1+1 Mini Pillows 140 g,$659
Huevos Gallina Feliz Grandes 18 un.,$7.299
Leche Loncoleche Break Capuccino 250 ml,$799
Leche Loncoleche Proteína Capuccino 200 ml,$629
Huevos La Granja Medianos Gallina Libre 18 un.,$5.249
Yogurt Nestlé Goodnes Sabor Frutilla 140 g,$549
Yogurt Nestlé Goodnes Natural Endulzado 140 g,$549
Compota Vivo Fruta Ciruela 120 g,$869
Huevos Omega3 Grandes 30 un.,$9.379
Leche Surlat Entera Sin Lactosa 1 L,$1.329
Yogurt Colun Protein Plus Frutilla 190 g,$1.199
Leche Soprole Entera Cremosa 1 L,$1.399
Huevos Cuisine & Co Grandes Color 12 un.,$3.599
Flan Soprole Postres de la Abuela Vainilla 120 g,$415
Leche Cultivada Soprole Proteina Chirimoya 1 L,$2.949
Leche Cultivada Soprole Proteína Frutilla 1 L,$2.949
Pack Leche Colun Semidescremada 200 ml 6 un.,$3.294
Pack Leche Colun Sin Lactosa Chocolate 200 ml 6 un.,$3.774
Mantequilla President Con Sal 200 g,$2.739
Leche Polvo Colun Entera 900 g,$7.990
Mantequilla Las Parcelas de Valdivia Con Sal 250 g,$3.590
Huevos Yemita Extra Blancos 12 un.,$3.999
Huevos Gallina Feliz Pollita Feliz Medianos Color 10 un.,$3.299
Leche Colun Descremada Sin Lactosa 200 ml,$539
Pack Petit Suisse Chiquitín Frutilla 45 g 12 un.,$3.799
Yogurt Colun Protein Plus Vainilla 150 g,$729
Yogurt Batido Light & Free Vainilla 115 g,$365
Postre Nestlé Leche Asada 120 g,$629
Huevos de Codorniz Cuisine & Co 24 un.,$2.999
Mantequilla Soprole Receta de Campo 250 g,$3.099
Pack Leche Colun Semidescremada Sin Lactosa 1 L 12 un.,$16.428
Yogurt Soprole Sin Azúcar Vainilla 155 g,$525
Yogurt Soprole Sin Azúcar Frutilla 155 g,$525
Postre Trencito Mousse Chocolate 70 g,$669
Yogurt Griego Quillayes Natural Pote 800 g,$3.199
Yogurt Natural Quillayes 0% Pote 800 g,$3.139
Yogurt Natural Quillayes Pote 800 g,$3.089
Margarina Soprole Mix 30% Mantequilla Pote 500 g,$3.999
Leche Loncoleche Cappucino Proteína 1 L,$1.900
Leche Loncoleche Proteína Chocolate 1 L,$1.900
Pack Leche Colun Light Chocolate 200 ml 6 un.,$3.774
Leche Soprole Proteína Chocolate 1 L,$2.339
Yogurt Griego Oikos Chirimoya 110 g,$359
Pack Bebida Láctea Yogu Yogu Mora 200 ml 6 un.,$3.630
Pack Leche Soprole Semidescremada Frutilla 200 ml 6 un.,$2.600
Pack Leche Loncoleche Semidescremada Sin Lactosa 200 ml 6 un.,$3.174
Yogurt Griego Nestlé Natural 120 g,$449
Jalea Colun Guinda 100 g,$299
Pack Leche Soprole Semidescremada Chocolate Requetepatitas 200 ml 6 un.,$2.600
Pack Leche Colun Semidescremada Sin Tapa 1 L 12 un.,$14.988
Pack Leche Colun Entera 200 ml 6 un.,$3.174
Pack Jalea Regimel Lima Limón 100 g 4 un.,$2.069
Flan Soprole Sin Lactosa Caramelo 120 g,$419
Flan Soprole Sin Lactosa Vainilla 120 g,$419
Margarina Sureña Mix 500 g,$3.669
Pack Bebida Láctea Chamyto Tutti-Frutti 80 ml 6 un.,$2.599
Mantequilla Quillayes Sin Lactosa 200 g,$3.449
Yogurt Griego Quillayes Light Berries 110 g,$519
Mantequilla Quillayes Sin Sal 250 g,$2.899
Leche Colun Chocolate Sin Lactosa 1 L,$1.999
Leche Colun Semidescremada Vainilla 1 L,$1.719
Leche Colun Semidescremada Frutilla 1 L,$1.719
Yogurt Batido Loncoleche Sin Lactosa Vainilla Bolsa 900 g,$2.139
Yogurt Soprole Batifrut Trozos Frutilla 165 g,$639
Jalea Nestlé Naranja 110 g,$375
Flan Colun Chocolate 100 g,$379
Yogurt Griego Quillayes Light Papaya 110 g,$519
Yogurt Griego Oikos Papaya 110 g,$569
Yogurt Griego Oikos Trozos Frutilla 110 g,$569
Yogurt Soprole Sin Azúcar Durazno 120 g,$325
Yogurt Batido Soprole Vainilla Botella 1 L,$2.489
Yogurt Batido Soprole Vainilla Bolsa 1 kg,$1.829
Yogurt Batido Soprole Vainilla 165 g,$489
Yogurt Batido Soprole Frambuesa 120 g,$265
Yogurt Batido Soprole Chirimoya 165 g,$489
Yogurt Batido Soprole Frutilla Botella 1 L,$2.489
Yogurt Batido Soprole Frutilla Bolsa 1 kg,$1.829
Yogurt Batido Soprole Frutilla 165 g,$489
Yogurt Batido Light & Free Natural Endulzado 115 g,$365
Yogurt Batido Light & Free Frutilla 115 g,$365
Yogurt Light & Free Natural Endulzado 900 g,$1.999
Yogurt Batido Colun Natural 1 kg,$1.889
Yogurt Batido Colun Frutilla 1 kg,$1.889
Yogurt Batido Colun Cereza 125 g,$295
Yogurt Batido Colun Damasco 1 kg,$1.889
Yogurt Batido Colun Frambuesa 125 g,$295
Pack Yogurt Batido Calán 110 g 12 un.,$2.849
Postre Soprole Manjarate Black 80 g,$709
Jalea Soprole Frambuesa 110 g,$309
Petit Suisse Chiquitín Frutilla 45 g,$335
Jalea Nestlé Piña 110 g,$375
Jalea Nestlé Frambuesa 110 g,$375
Jalea Colun Limón 100 g,$299
Flan Colun Vainilla 100 g,$379
Margarina Qualy Con Sal 500 g,$2.599
Margarina Soprole Next Light Pote 500 g,$2.190
Mantequilla Los Alerces Con Sal 250 g,$3.199
Mantequilla Loncoleche Con Aceite de Canola 250 g,$3.789
Manteca Crucina 200 g,$1.819
Leche Soprole Semidescremada Chocolate Requetepatitas 1 L,$1.499
Leche Soprole Sin Lactosa Chocolate 200 ml,$505
Leche Colun Semidescremada Vainilla 200 ml,$579
Leche Colun Semidescremada Frutilla 200 ml,$579
Leche Cultivada Soprole Next Frutilla 1 L,$2.049
Leche Cultivada Soprole Next Chirimoya 1 L,$2.049
Leche Polvo Svelty Descremada 800 g,$7.220
Leche Loncoleche Descremada Sin Lactosa Extra Calcio 1 L,$2.369
Huevos Santa Marta Grandes Color 30 un.,$9.149
Huevos Santa Marta Extra Color 12 un.,$3.999
Huevos Omega3 Grandes Color Plus 12 un.,$4.649
Huevos Gallina Feliz Extra Grandes 12 un.,$4.869
Huevos Cintazul Grandes Color 12 un.,$4.049
Huevos Cintazul XL 20 un.,$6.999
Huevos Cintazul Super Extra Blancos 12 un.,$4.149
Yogurt Con Cereal Soprole 1+1 Choco Krispis 140 g,$659
Manteca Astra 200 g,$1.550
Yogurt Colun Origen Frutilla 900 ml,$2.099
Pack Leche Soprole Semidescremada con Avena 200 ml 6 un.,$2.400
Yogurt Soprole Sin Azúcar Natural Endulzado 120 g,$325
Yogurt Soprole Sin Azúcar Trozos Frutos del Bosque 155 g,$625
Yogurt Nestlé Goodnes Protein Chirimoya 140 g,$589
Yogurt Activia Sabor Ciruela Sin Lactosa 140 g,$459
Yogurt Activia Trozos Frutos del Bosque Sin Lactosa 140 g,$569
Yogurt Activia Semillas-Trozos Piña Sin Lactosa 140 g,$569
Yogurt Activia Semillas-Trozos Frutilla 140 g,$569
Leche Cultivada Loncoleche Protein Sabor Chirimoya 900 g,$2.739
Yogurt Activia Semillas-Trozos Durazno Sin Lactosa 140 g,$569
Postre Chandelle Brownie 130 g,$799
Yogurt Soprole 1+1 Sin Lactosa Choco Krispis 140 g,$669
Yogurt Batido Soprole Mora 120 g,$265
Leche Colun A2 Entera Sin Lactosa 1 L,$2.599
Yogurt Soprole Proteina Nitro Trozos Frambuesa 155 g,$729
Pack Leche Soprole Protein Nitro Vainilla 200 ml 6 un.,$3.774
Leche Soprole Protein Nitro Vainilla 1 L,$2.499
Leche Soprole Protein Nitro Vainilla 200 ml,$629
Yogurt Kéfir Soprole Trozo Piña 155 g,$549
Huevos Yemita Extra Blanco 18 un.,$5.599
Yogurt Colun Light Sin Lactosa Chirimoya 900 g,$1.979
Yogurt Colun Light Sin Lactosa Frutilla 900 g,$1.979
Margarina Cuisine & Co Mix 450 g,$2.839
Yogurt Loncoleche Sin Lactosa Durazno 140 g,$559
Yogurt Loncoleche Sin Lactosa Papaya 140 g,$559
Pack Bebida Láctea Chamyto Frutilla 80 ml 18 un.,$6.349
Yogurt Colun Light Vainilla 900 g,$1.799
Postre Colun del Sur Chocolate Blanco 110 g,$619
Yogurt Colun Origen Frutilla 120 g,$379
Postre Manjarate Soprole Blanjarate 80 g,$709
Huevos del Granero Gallinas Libres Extra Color 20 un.,$8.249
Yogurt Batido Chamyto Frutilla 115 g,$329
Pack Jalea Nestlé Goodnes Durazno 110 g 4 un.,$1.759
Flan Colun del Sur Panna Cotta Frutos Rojos 100 g,$439
Leche Soprole Semidescremada Cookies And Cream 1 L,$1.499
Pack Leche Soprole Semidescremada Cookies And Cream 200 ml 6 un.,$2.600
Jalea Soprole Frutilla Guinda Mango Maracuyá 110 g,$309
Leche Polvo Nido Etapa 3+ 700 g,$7.590
Fórmula Láctea Nido Etapa 1+ 700 g,$7.990
Leche Polvo Nido Etapa 5+ 700 g,$7.590
Leche Polvo Nido Semidescremada Sin Lactosa 700 g,$9.990
Bebida Láctea Soprole Kéfir Tropical 1 L,$2.199
Yogurt Danone Oikos Proteína Trozos Frutilla 130 g,$809
Leche Polvo Nido 1+ Protec 1.35 kg,$17.450
Yogurt Batido Light & Free Trozos Papaya 145 g,$589
Leche Polvo Nido Entera 800 g,$9.190
Bebida Láctea Nido Buen Día Semidescremada 700 g,$6.149
Pack Yogurt Batido Colun Frutos del Sur 125 g 12 un.,$3.469
Yogurt Skyr Light & Free Berries 140 g,$729
Leche Cultivada Loncoleche Protein Berries 900 ml,$2.739
Yogurt Soprole Sin Lactosa Trozos Frutos Secos 155 g,$665
Yogurt Batido Soprole Chirimoya Bolsa 1 kg,$2.099
Yogurt Batido Soprole Frutilla Bolsa 1 kg,$2.099
Huevos Cintazul Gallinas Libre Pastoreo Grandes Color 12 un.,$5.299
Mantequilla Futaleufú Artesanal 250 g,$3.399
Pack Yogurt Con Cereal Soprole 1+1 Zucaritas + Mini Cookies 140 g 5 un.,$3.199
Leche Loncoleche Proteína Chocolate 200 ml,$629
Leche Loncoleche Protein Full Pro Vainilla 250 ml,$1.689
Postre Sahne Nuss Mousse de Chocolate 100 g,$719
Yogurt Nestlé Goodnes Sabor Vainilla 140 g,$549
Huevos Ecoterra Gallinas Libres Orgánicos 10 un.,$5.499
Postre Chandelle Crema Sin Lactosa Manjar 130 g,$849
Yogurt Griego Quillayes Proteína Berries 110 g,$599
Flan Soprole Postres de la Abuela Caramelo 120 g,$415
Yogurt Vegetal Almendras Loncoleche Natural Endulzado 140 g,$639
Pack Leche Soprole Entera Natural 200 ml 6 un.,$2.814
Yogurt Batido Light & Free Vainilla 900 g,$1.999
Pack Leche Cuisine & Co Descremada 1 L 12 un.,$12.708
Pack Leche Cuisine & Co Semidescremada 1 L 12 un.,$12.708
Postre Chandelle Crema Sin Lactosa Sabor Chocolate 130 g,$849
Leche Polvo Colun Descremada 800 g,$7.070
Leche Polvo Colun Descremada 350 g,$3.669
Leche Soprole Entera Natural 200 ml,$489
Huevos Coliumo Premium Grandes Blancos 12 un.,$3.799
Huevos Coliumo Premium Grandes Blancos 30 un.,$9.299
Postre Soprole Manjarate 3D 100 g,$709
Pack Yogurt Batido Nestlé Tradicional 115 g 12 un.,$3.499
Pack Jalea Regimel Sin Azúcar Maracuyá 100 g 4 un.,$2.069
Leche Colun Semidescremada 200 ml,$549
Yogurt Loncoleche Protein Berries Trozos 140 g,$719
Alimento de Coco Nestlé Veggie Berries 115 g,$519
Alimento de Coco Nestlé Veggie Frutilla 115 g,$519
Alimento de Coco Nestlé Veggie Natural Endulzado 115 g,$519
Yogurt Griego Colun Light Berries 120 g,$609
Yogurt Griego Colun Light Frutilla 120 g,$609
Pack Leche Colun Caramel Light Sin Lactosa 330 ml 3 un.,$3.177
Pack Probiótico Uno Multifruta 80 ml 6 un.,$2.089
Yogurt Skyr San Benito Frutos del Bosque 150 g,$969
Yogurt Skyr San Benito Natural 150 g,$969
Yogurt Griego Quillayes Triple 0% Natural 400 g,$1.669
Yogurt Griego Quillayes Natural 400 g,$1.699
Yogurt Griego Artisan Natural 360 g,$1.999
Yogurt Griego Quillayes Triple 0% Berries Pote 800 g,$3.729
Mantequilla San Ignacio de Campo 230 g,$3.359
Leche Soprole Proteína Chocolate 200 ml,$605
Pack Leche Loncoleche Light Chocolate 200 ml 6 un.,$3.174
Leche Colun Semidescremada Chocolate 200 cc,$579
Pack Leche Colun Manjar 200 ml 6 un.,$3.474
Pack Leche Colun Descremada 200 ml 6 un.,$3.294
Leche Loncoleche Break Sin Lactosa Cappuccino 1 L,$2.599
Leche Colun Capuccino Light Sin Lactosa 330 cc,$1.059
Pack Bebida Láctea Loncoleche Protein Shot Berries 100 ml 6 un.,$3.849
Pack Leche Colun Entera Sin Tapa 1 L 12 un.,$14.988
Pack Leche Colun Descremada Sin Tapa 1 L 12 un.,$14.988
Pack Jalea Regimel Naranja Plátano 100 g 4 un.,$2.069
Pack Bebida Láctea Chamyto Frutilla 80 ml 6 un.,$2.599
Yogurt Batido Light & Free Arándano 115 g,$365
Yogurt Griego Quillayes Sin Lactosa Frutilla 110 g,$499
Yogurt Griego Quillayes Light Duraznos 110 g,$519
Leche Colun Semidescremada Manjar 1 L,$1.719
Yogurt Loncoleche Sin Lactosa Frutilla 900 g,$2.139
Mantequilla Surlat Reducida En Colesterol 250 g,$3.399
Postre Soprole Sémola Frambuesa 140 g,$669
Postre Soprole Gold Pannacotta Frambuesa 120 g,$719
Postre Soprole Gold Creme Caramel 120 g,$719
Yogurt Soprole Batifrut Trozos Durazno 165 g,$639
Yogurt Soprole Batifrut Trozos Piña 165 g,$639
Pack Leche Soprole Semidescremada Natural 1 L 12 un.,$14.388
Pack Leche Soprole Descremada Natural 1 L 12 un.,$14.388
Leche Polvo Svelty Sin Lactosa Descremada 800 g,$11.290
Yogurt Soprole Gold Lúcuma Nuez 165 g,$699
Yogurt Soprole Gold Chocolate Almendra 165 g,$699
Yogurt Griego Oikos Colchón de Frutilla 150 g,$709
Yogurt Griego Oikos Colchón de Papaya 150 g,$709
Yogurt Griego Oikos Colchón de Frutos del Bosque 150 g,$709
Yogurt Griego Oikos Coco Rallado 110 g,$569
Yogurt Colun Yogumix Chococolores 140 g,$689
Pack Yogurt Batido Soprole Sabores 120 g 12 un.,$2.999
Yogurt Batido Soprole Damasco Botella 1 L,$2.489
Yogurt Batido Soprole Damasco Bolsa 1 kg,$1.829
Pack Probiótico Uno Multifruta 80 ml 6 un.,$2.229
Yogurt Batido Light & Free Frutilla 900 g,$1.999
Yogurt Batido Colun Mora 1 kg,$1.889
Yogurt Batido Colun Frambuesa 1 kg,$1.889
Pack Yogurt Con Cereal Colun Kids Yogumix 140 g 5 un.,$3.239
Yogurt Batido Calán Vainilla 1 kg,$1.619
Yogurt Batido Calán Semidescremado Vainilla 110 g,$265
Yogurt Batido Calán Semidescremado Frutilla 110 g,$265
Compota Soprole Manzana 110 g,$475
Compota Soprole Pera 110 g,$475
Postre Chandelle Crema Sabor Lúcuma 130 g,$799
Flan Nestlé Vainilla 110 g,$385
Flan Nestlé Chocolate 110 g,$385
Flan Nestlé Caramelo 110 g,$385
Margarina Sureña Light 500 g,$2.719
Margarina Soprole 250 g,$1.000
Mantequilla Calo Con Sal 250 g,$2.390
Bebida Láctea Yogu Yogu Frutilla 200 ml,$605
Bebida Láctea Yogu Yogu Chirimoya 200 ml,$605
Leche Soprole Semidescremada Frutilla 1 L,$1.499
Leche Soprole Semidescremada Chocolate 200 ml,$525
Leche Loncoleche Light Descremada Chocolate 1 L,$1.949
Leche Cultivada Soprole Frutilla 1 L,$1.900
Leche Cultivada Soprole Chirimoya 1 L,$1.900
Leche Cultivada Soprole Vainilla 1 L,$1.900
Leche Cultivada Soprole Sin Lactosa Frutilla 1 L,$2.449
Leche Cultivada Soprole Sin Lactosa Chirimoya 1 L,$2.449
Leche Cultivada Soprole Next Frambuesa 1 L,$2.049
Leche Cultivada Colun Light 0% + Fibra Frambuesa 1 L,$2.079
Leche Cultivada Colun Light con Fibra Frutilla 180 ml,$579
Leche Cultivada Colun Light con Fibra Chirimoya 180 cc,$579
Leche Danone Moments Cappuccino 200 ml,$719
Leche Danone Moments Cappuccino 1 L,$2.589
Leche Colun Entera 200 ml,$529
Leche Colun Descremada 200 ml,$549
Huevos Omega3 Plus 6 un.,$2.429
Margarina Soprole Con Toques Mantequilla 500 g,$2.490
Leche Semidescremada Soprole con Avena 200 ml,$489
Pack Jalea Nestlé Bilz 110 g 4 un.,$1.769
Pack Yogurt Batido Yogu Yogu Vainilla 115 ml 6 un.,$2.214
Postre Chandelle Suspiro Maracuyá 130 g,$799
Pack Leche Surlat Descremada Surtlat 1 L 12 un.,$13.668
Pack Leche Surlat Semidescremada 1 L 12 un.,$13.668
Yogurt Soprole Next Colágeno Vainilla 155 g,$599
Yogurt Soprole Next Colágeno Frutilla 155 g,$599
Yogurt Kéfir Soprole Batido Tropical 155 g,$439
Yogurt Kéfir Soprole Trozo Frutilla 155 g,$549
Yogurt Soprole Sin Lactosa Chocolate Almendras 155 g,$665
Leche Soprole Sin Lactosa Zerolacto Frutilla 200 ml,$505
Pack Leche Soprole Sin Lactosa Zerolacto Frutilla 200 ml 6 un.,$3.030
Mantequilla Ecoterra Con Sal del Himalaya Vacas Libre Pastoreo 250 g,$4.125
Bebida Láctea Kéfir Quillayes 400 g,$1.839
Yogurt Colun Light Frutilla 900 g,$1.799
Yogurt Colun Light Natural 900 g,$1.799
Yogurt Loncoleche Sin Lactosa Chirimoya 140 g,$390
Yogurt Loncoleche Sin Lactosa Berries 140 g,$559
Pack Bebida Láctea Surlat Sin Lactosa Probióticos Frutilla 12 un.,$3.999
Yogurt Nestlé Goodnes Trozos Berries Toques de Acai 140 g,$699
"Yogurt Nestlé Goodnes Trozos Plátano, Frutilla y Manzanilla 140 g",$699
"Yogurt Nestlé Goodnes Trozos Manzana, Ciruela y Chía 140 g",$699
"Yogurt Nestlé Goodnes Trozos Mango, Guaraná, Jengibre y Té Verde 140 g",$699
Leche Polvo Loncoleche Semidescremada 760 g,$6.649
Saborizante Swiss Miss Chocolate Sin Azúcar 108 g,$3.003
Yogurt Batido Chamyto Plátano 115 g,$329
Yogurt Batido Chamyto Damasco 115 g,$329
Yogurt Batido Chamyto Vainilla 115 g,$329
Flan Colun del Sur Caramelo Toffe 100 g,$439
Flan Colun del Sur Chocolate Avellana 100 g,$439
Leche Soprole Semidescremada Cookies And Cream 200 ml,$525
Yogurt Soprole Batifrut Cremoso Durazno 120 g,$529
Jalea Soprole Manzana Limón 110 g,$309
Leche Polvo Nido Etapa 1+ 1.9 kg,$19.190
Yogurt Soprole Gold Semillas Calabaza Almendra 165 g,$699
Huevos Coliumo Extra Color 18 un.,$6.099
Leche Polvo Nido Semidescremada 700 g,$8.490
Leche Cultivada Soprole Proteína Natural 1 L,$2.949
Leche Surlat Proteína Descremada Sin Lactosa 1 L,$2.229
Leche Cultivada Soprole Proteína Tropical 1 L,$2.949
Yogurt Danone Oikos Proteína Trozos Mango Maracuyá 130 g,$809
Postre Soprole Gold Café Juan Valdes 120 g,$719
Leche Polvo Nido 5+ Protec 1.35 kg,$16.680
Leche Semidescremada Nido 3+ Protec 1.35 kg,$16.590
Pack Yogurt Kéfir Quillayes Maqui 80 ml 4 un.,$2.350
Yogurt Colun del Sur Frutos Secos 120 g,$529
Yogurt Batido Light & Free Trozos Frutilla 145 g,$589
Yogurt Skyr Light & Free Durazno 140 g,$729
Cultivo Láctico Polvo Yogustart Pro8 Probiotics Para Yogurt 5 un.,$5.699
Leche Loncoleche Proteína Full Pro Chocolate 250 ml,$1.689
Margarina Qualy Vegetal 500 g,$2.579
Mantequilla Granarolo Italiana Con Sal 200 g,$3.049
Leche Loncoleche Break Chocolate Avellanas 250 ml,$799
Huevos del Granero Gallinas Libres Grandes 12 un.,$4.699
Yogurt Artesanal Jumbo Natural 200 g,$1.249
Yogurt Griego Quillayes Proteína Durazno 110 g,$599
Leche Surlat Proteína Sin Lactosa Chocolate 1 L,$2.419
